case_id,target_id,symbol,company_name,market,case_type,canonical_archetype,posture,evidence_fields,red_flag_fields,price_validation_status,production_input,notes
berkshire_japan_sogo_shosha_long_term_rerating_candidate,GENERAL_TRADING_RESOURCE_INFRA,JP_SOGO,일본 종합상사 장기 리레이팅 후보,JP,success_candidate,HOLDING_RESTRUCTURING_GOVERNANCE,GREEN_POSSIBLE,resource_project_rights|diversified_fcf|shareholder_return,commodity_price|conglomerate_discount,needs_price_backfill,false,"Sogo shosha reference case needs project rights, FCF, and capital-allocation validation."
posco_international_alaska_lng_20y_contract_candidate,GENERAL_TRADING_RESOURCE_INFRA,047050,POSCO International Alaska LNG 20년 계약,KR,success_candidate,HOLDING_RESTRUCTURING_GOVERNANCE,GREEN_POSSIBLE,long_term_offtake|project_equity|steel_supply_linkage,project_execution|fx,needs_price_backfill,false,Long-term LNG plus project participation is stronger than plain trading revenue.
trading_house_commodity_cycle_counterexample,GENERAL_TRADING_RESOURCE_INFRA,TRADING_CYCLE,종합상사 상품가격 사이클 반례,GLOBAL,failed_rerating,HOLDING_RESTRUCTURING_GOVERNANCE,GREEN_POSSIBLE,resource_trading,commodity_price|low_margin_trading,needs_price_backfill,false,Commodity-price revenue without FCF/capital allocation should stay capped.
conglomerate_discount_no_capital_return_counterexample,GENERAL_TRADING_RESOURCE_INFRA,CONGLO_NORETURN,복합기업 할인 자본배분 부재 반례,GLOBAL,failed_rerating,HOLDING_RESTRUCTURING_GOVERNANCE,GREEN_POSSIBLE,conglomerate_discount,no_capital_return|conglomerate_discount_persistent,needs_price_backfill,false,"Discount can remain justified without cancellation, dividends, or FCF improvement."
posco_international_lng_long_term_offtake_candidate,LNG_ENERGY_TRADING_DISTRIBUTION,047050_LNG,POSCO International LNG 장기 offtake,KR,success_candidate,COMMODITY_SPREAD,WATCH_YELLOW_FIRST,long_term_supply_contract|procurement_stability,geopolitics|pass_through_failure,needs_price_backfill,false,LNG long-term supply can support Watch-to-Green if pass-through and FCF are visible.
sk_innovation_refining_recovery_watch,LNG_ENERGY_TRADING_DISTRIBUTION,096770,SK Innovation 정제마진 회복 Watch,KR,cyclical_success,COMMODITY_SPREAD,WATCH_YELLOW_FIRST,refining_margin|operating_margin_not_inventory_only,inventory_loss|refining_spread_normalization,needs_price_backfill,false,Refining recovery is useful but remains cycle-capped until structural margin evidence appears.
lng_tariff_geopolitics_4c,LNG_ENERGY_TRADING_DISTRIBUTION,LNG_GEO_4C,LNG 관세 지정학 4C,GLOBAL,4c_thesis_break,COMMODITY_SPREAD,WATCH_YELLOW_FIRST,lng_lpg_distribution,tariff_reversal|geopolitical_disruption,needs_price_backfill,false,Tariff or geopolitics can break LNG distribution visibility.
energy_price_inventory_loss_counterexample,LNG_ENERGY_TRADING_DISTRIBUTION,ENERGY_INV_LOSS,에너지가격 재고손실 반례,GLOBAL,failed_rerating,COMMODITY_SPREAD,WATCH_YELLOW_FIRST,energy_trading,inventory_loss|energy_price,needs_price_backfill,false,Inventory gains/losses must not be annualized as structural FCF.
apple_all_iphone_oled_transition_candidate,DISPLAY_OLED_SUPPLYCHAIN,OLED_IPHONE,Apple 전모델 OLED 전환 후보,GLOBAL,success_candidate,SEMI_EQUIPMENT_CAPEX,GREEN_POSSIBLE,customer_oled_adoption|oled_transition,panel_price_competition|customer_concentration,needs_price_backfill,false,OLED penetration is Stage 1/2 evidence; orders and margins still need validation.
lg_display_lcd_exit_oled_focus_candidate,DISPLAY_OLED_SUPPLYCHAIN,034220,LG Display LCD 매각 OLED 집중,KR,success_candidate,SEMI_EQUIPMENT_CAPEX,GREEN_POSSIBLE,lcd_restructuring|oled_order_or_supply,capex_cycle|panel_price_competition,needs_price_backfill,false,LCD exit can improve mix if OLED margin and demand are source-backed.
oled_capex_cycle_counterexample,DISPLAY_OLED_SUPPLYCHAIN,OLED_CAPEX_CYCLE,OLED CAPEX 사이클 반례,KR,failed_rerating,SEMI_EQUIPMENT_CAPEX,GREEN_POSSIBLE,display_capex,capex_cycle|customer_order_cut,needs_price_backfill,false,One display equipment cycle is not enough for Green.
oled_panel_price_competition_4c,DISPLAY_OLED_SUPPLYCHAIN,OLED_PRICE_4C,OLED 패널 가격경쟁 4C,GLOBAL,4c_thesis_break,SEMI_EQUIPMENT_CAPEX,GREEN_POSSIBLE,oled_transition,panel_price_drop|china_price_competition,needs_price_backfill,false,OLED penetration can still fail if panel prices and margins collapse.
murata_capex_mna_component_growth_candidate,ELECTRONIC_COMPONENTS_MLCC_SENSOR,6981.T,Murata CAPEX M&A 전자부품 성장,JP,success_candidate,AUTO_MOBILITY_COMPONENTS,GREEN_POSSIBLE,mlcc_sensor_component|customer_diversification|capex_to_revenue_conversion,rare_earth_dependency|inventory_cycle,needs_price_backfill,false,"Component growth needs customer mix and revenue conversion, not CAPEX headline alone."
tdk_silicon_anode_component_candidate,ELECTRONIC_COMPONENTS_MLCC_SENSOR,6762.T,TDK 실리콘 음극재 전자부품 후보,JP,success_candidate,AUTO_MOBILITY_COMPONENTS,GREEN_POSSIBLE,high_value_component_demand|technology_lead,component_price_pressure|customer_concentration,needs_price_backfill,false,High-value component demand can support Watch-to-Green when margins and customers are visible.
mlcc_inventory_cycle_counterexample,ELECTRONIC_COMPONENTS_MLCC_SENSOR,MLCC_INV,MLCC 재고 사이클 반례,GLOBAL,failed_rerating,AUTO_MOBILITY_COMPONENTS,GREEN_POSSIBLE,mlcc_sensor_component,inventory_glut|component_price_drop,needs_price_backfill,false,MLCC cycle rebound should be capped when inventory is rising.
rare_earth_supply_chain_risk_4c,ELECTRONIC_COMPONENTS_MLCC_SENSOR,RARE_EARTH_4C,희토류 공급망 리스크 4C,GLOBAL,4c_thesis_break,AUTO_MOBILITY_COMPONENTS,GREEN_POSSIBLE,auto_component,supply_chain_disruption|rare_earth_dependency,needs_price_backfill,false,Rare-earth or China supply-chain disruption can break component visibility.
samsung_xealth_digital_health_platform_candidate,DIGITAL_HEALTHCARE_REMOTE_MEDICINE,005930_XEALTH,Samsung Xealth 디지털헬스 플랫폼,KR,success_candidate,PLATFORM_SOFTWARE_INTERNET,GREEN_POSSIBLE,digital_health_platform|hospital_workflow,regulation|data_security,needs_price_backfill,false,"Platform integration is positive only if contracts, usage, and economics are visible."
teladoc_subscription_virtual_care_reference,DIGITAL_HEALTHCARE_REMOTE_MEDICINE,TDOC,Teladoc 구독형 원격진료 참고,US,success_candidate,PLATFORM_SOFTWARE_INTERNET,GREEN_POSSIBLE,recurring_subscription|real_patient_usage,unit_economics|reimbursement,needs_price_backfill,false,Subscription reference case needs unit-economics and payer validation.
telemedicine_no_reimbursement_counterexample,DIGITAL_HEALTHCARE_REMOTE_MEDICINE,REMOTE_NOREIMB,원격의료 수가 부재 반례,GLOBAL,failed_rerating,PLATFORM_SOFTWARE_INTERNET,GREEN_POSSIBLE,remote_medicine,reimbursement_failure|regulatory_reversal,needs_price_backfill,false,Remote-care usage without reimbursement cannot support Green.
remote_care_unit_economics_4c,DIGITAL_HEALTHCARE_REMOTE_MEDICINE,REMOTE_UNIT_4C,원격진료 unit economics 4C,GLOBAL,4c_thesis_break,PLATFORM_SOFTWARE_INTERNET,GREEN_POSSIBLE,real_patient_usage,unit_economics_break|clinical_liability,needs_price_backfill,false,High usage can still fail if contribution margin or liability breaks.
samsung_commodity_memory_price_recovery_candidate,COMMODITY_MEMORY_GENERAL_SEMI,005930_MEM,Samsung 범용메모리 가격회복 후보,KR,cyclical_success,MEMORY_HBM_CAPACITY,GREEN_POSSIBLE,memory_price_increase|op_eps_revision|ai_server_demand,hbm_lag|supply_rebound,needs_price_backfill,false,Commodity memory EPS recovery is meaningful but lower-visibility than HBM allocation.
samsung_hbm_lag_counterexample,COMMODITY_MEMORY_GENERAL_SEMI,005930_HBM_LAG,Samsung HBM lag 반례,KR,failed_rerating,MEMORY_HBM_CAPACITY,GREEN_POSSIBLE,commodity_memory,hbm_lag|hbm_customer_validation_failure,needs_price_backfill,false,HBM lag can cap rerating despite DRAM/NAND recovery.
simple_dram_spot_rebound_counterexample,COMMODITY_MEMORY_GENERAL_SEMI,DRAM_SPOT,단순 DRAM spot 반등 반례,GLOBAL,failed_rerating,MEMORY_HBM_CAPACITY,GREEN_POSSIBLE,dram_nand_price_recovery,spot_rebound_only|cycle,needs_price_backfill,false,Spot rebound alone is not structural visibility.
ai_capex_slowdown_memory_4c,COMMODITY_MEMORY_GENERAL_SEMI,AI_CAPEX_MEM_4C,AI CAPEX 둔화 메모리 4C,GLOBAL,4c_thesis_break,MEMORY_HBM_CAPACITY,GREEN_POSSIBLE,ai_server_memory_demand,ai_capex_slowdown|memory_price_decline,needs_price_backfill,false,AI capex slowdown can break memory price and revision path.
kogas_tariff_normalization_candidate,ENERGY_UTILITY_LNG_GAS,036460,KOGAS 요금정상화 후보,KR,success_candidate,UTILITIES_REGULATED_TARIFF,WATCH_YELLOW_FIRST,tariff_normalization|receivables_recovery,debt|policy_risk,needs_price_backfill,false,"Gas utility recovery needs tariff, receivables, debt, and FCF evidence."
lng_long_term_supply_candidate,ENERGY_UTILITY_LNG_GAS,LNG_SUPPLY,LNG 장기공급 유틸리티 후보,GLOBAL,success_candidate,UTILITIES_REGULATED_TARIFF,WATCH_YELLOW_FIRST,lng_procurement_stability|fcf_improvement,lng_price|tariff_regulation,needs_price_backfill,false,Long-term LNG supply is useful only when cost pass-through is visible.
tariff_freeze_debt_4c,ENERGY_UTILITY_LNG_GAS,TARIFF_DEBT_4C,요금동결 부채 4C,KR,4c_thesis_break,UTILITIES_REGULATED_TARIFF,WATCH_YELLOW_FIRST,lng_utility,tariff_freeze|debt_burden,needs_price_backfill,false,Tariff freeze and debt burden can block utility rerating.
lng_price_spike_receivables_counterexample,ENERGY_UTILITY_LNG_GAS,LNG_RECV,LNG 가격급등 미수금 반례,KR,failed_rerating,UTILITIES_REGULATED_TARIFF,WATCH_YELLOW_FIRST,gas_distribution,receivables_growth|cost_pass_through_failure,needs_price_backfill,false,Rising receivables are not FCF improvement.
samsung_tesla_foundry_deal_candidate,AI_CHIP_FABRIC_INFRA,005930_TESLA,Samsung Tesla foundry deal 후보,KR,success_candidate,AI_DATA_CENTER_INFRASTRUCTURE,REDTEAM_FIRST,customer_contract|foundry_deal|direct_revenue_exposure,yield|customer_validation,needs_price_backfill,false,"Foundry deal is positive only if validation, yield, and revenue conversion are visible."
openai_samsung_sk_memory_partnership_candidate,AI_CHIP_FABRIC_INFRA,AI_MEMORY_PARTNER,OpenAI Samsung SK memory partnership 후보,KR,success_candidate,AI_DATA_CENTER_INFRASTRUCTURE,REDTEAM_FIRST,foundry_packaging_memory_link|customer_contract,theme_overheat|unclear_equity_exposure,needs_price_backfill,false,AI ecosystem partnership needs direct revenue exposure before score credit.
ai_chip_related_stock_no_revenue_counterexample,AI_CHIP_FABRIC_INFRA,AI_CHIP_NOREV,AI칩 관련주 무매출 반례,KR,failed_rerating,AI_DATA_CENTER_INFRASTRUCTURE,REDTEAM_FIRST,ai_chip,no_revenue|unclear_equity_exposure,needs_price_backfill,false,Related-stock label is not score evidence without contract or revenue.
foundry_yield_customer_validation_4c,AI_CHIP_FABRIC_INFRA,FOUNDRY_YIELD_4C,파운드리 수율 고객검증 4C,GLOBAL,4c_thesis_break,AI_DATA_CENTER_INFRASTRUCTURE,REDTEAM_FIRST,system_semiconductor,customer_validation_failure|yield_issue,needs_price_backfill,false,Yield or validation failure can break AI-chip/foundry thesis.
